"3f5b87392fcdfaa3928e2ede9b0703a535ac9cc8";"Rue de Reims, Berru, Reims, Marne, Grand Est, France métropolitaine, 51420, France";"";"Rue de Reims";"";"Reims";"Marne";"Grand Est";"51420";"France";"49.2715193";"4.1518334"
"4c4d4fa3af5958f0a1e133ad5aceec057ffb3e3b";"Boulevard Jean Brion, Vertus, Blancs-Coteaux, Épernay, Marne, Grand Est, France métropolitaine, 51130, France";"";"Boulevard Jean Brion";"";"Épernay";"Marne";"Grand Est";"51130";"France";"48.9078708";"4.0022086"
"c0ca431e0c8976fac6f875813907c9af76586cda";"Rue Haute, Bussy-Lettrée, Châlons-en-Champagne, Marne, Grand Est, France métropolitaine, 51320, France";"";"Rue Haute";"";"Châlons-en-Champagne";"Marne";"Grand Est";"51320";"France";"48.7931324";"4.2653235"
"a2e500d439a854b2ef729b276d30b903398426ed";"Rue Charles de Gaulle, Cernay-lès-Reims, Reims, Marne, Grand Est, France métropolitaine, 51420, France";"";"Rue Charles de Gaulle";"";"Reims";"Marne";"Grand Est";"51420";"France";"49.2613455";"4.0957687"
"ef7966c38f4510fdc170984724e215993cd80a82";"2, Boulevard Victor Hugo, Châlons-en-Champagne, Marne, Grand Est, France métropolitaine, 51000, France";"2";"Boulevard Victor Hugo";"Châlons-en-Champagne";"Châlons-en-Champagne";"Marne";"Grand Est";"51000";"France";"48.9544735";"4.361535075000001"
"8f2c5c664b5fe20dadddad3bbc759e299b26c765";"Rue Jean Moët, Épernay, Marne, Grand Est, France métropolitaine, 51200, France";"";"Rue Jean Moët";"Épernay";"Épernay";"Marne";"Grand Est";"51200";"France";"49.0441279";"3.9580425"
"8f2c5c664b5fe20dadddad3bbc759e299b26c765";"Rue Jean Moët, Épernay, Marne, Grand Est, France métropolitaine, 51200, France";"";"Rue Jean Moët";"Épernay";"Épernay";"Marne";"Grand Est";"51200";"France";"49.0441279";"3.9580425"
"0ad8f15de2ba4662afe66ebf40e15debbb792556";"Place Lasnier, La Villa, Épernay, Marne, Grand Est, France métropolitaine, 51200, France";"";"";"Épernay";"Épernay";"Marne";"Grand Est";"51200";"France";"49.046807599999994";"3.9677434324712677"
"51d4377658b84d708b04c4ad97e6a1c4af60bb54";"Grande Rue, Germaine, Épernay, Marne, Grand Est, France métropolitaine, 51160, France";"";"Grande Rue";"";"Épernay";"Marne";"Grand Est";"51160";"France";"49.112719";"4.0297924"
"db2649f5d2798b0d54181109329532ba3e00eac1";"9, Place de la République, Ludes, Reims, Marne, Grand Est, France métropolitaine, 51500, France";"9";"Place de la République";"";"Reims";"Marne";"Grand Est";"51500";"France";"49.1540054";"4.0802029"
"7ce22ae85a73eae57c48d10c445f036f78b7fa1d";"Quai de Seine, Marcilly-sur-Seine, Épernay, Marne, Grand Est, France métropolitaine, 51260, France";"";"Quai de Seine";"";"Épernay";"Marne";"Grand Est";"51260";"France";"48.5573185";"3.7128466"
"c2172d0ea0b841e680ca32a71a14720e10f3f742";"Rue Royale, Moncetz-Longevas, Châlons-en-Champagne, Marne, Grand Est, France métropolitaine, 51470, France";"";"Rue Royale";"";"Châlons-en-Champagne";"Marne";"Grand Est";"51470";"France";"48.9089839";"4.4282123"
"0ad124aff56d310f512267c6d783d54a912119e2";"Place du Général Leclerc, Monthelon, Épernay, Marne, Grand Est, France métropolitaine, 51530, France";"";"Place du Général Leclerc";"";"Épernay";"Marne";"Grand Est";"51530";"France";"48.9937618";"3.9352835"
"a66dbd218d3b1ddc0606bdbb0ef4f84b10d67b74";"Rue des Remparts de l'Est, Montmirail, Épernay, Marne, Grand Est, France métropolitaine, 51210, France";"";"Rue des Remparts de l'Est";"";"Épernay";"Marne";"Grand Est";"51210";"France";"48.87022";"3.5407979"
"93e3d1508b1582c761e714ae01a30627b7898f5f";"Rue de l'Orme, Plichancourt, Vitry-le-François, Marne, Grand Est, France métropolitaine, 51300, France";"";"Rue de l'Orme";"";"Vitry-le-François";"Marne";"Grand Est";"51300";"France";"48.7462138";"4.677103"
"82b9bc302cb496f7f545c1a82f969f24f4317fc8";"25, Rue Libergier, Quartier Centre Ville, Reims, Marne, Grand Est, France métropolitaine, 51100, France";"25";"Rue Libergier";"";"Reims";"Marne";"Grand Est";"51100";"France";"49.2522866";"4.0303139"
"004b4387d5ee5e553d53238162a946ee5c556ce7";"3, Rue de la Roseraie, Reims, Marne, Grand Est, France métropolitaine, 51100, France";"3";"Rue de la Roseraie";"";"Reims";"Marne";"Grand Est";"51100";"France";"49.237145";"4.0397668"
"a5cd18f4c1ee48ee9c5690e9f9017db9fbd752cc";"45, Boulevard Foch, Quartier Centre Ville, Reims, Marne, Grand Est, France métropolitaine, 51100, France";"45";"Boulevard Foch";"";"Reims";"Marne";"Grand Est";"51100";"France";"49.2575521";"4.0263065"
"0f03c43855612b2e00ec978f06f42e85d806df47";"8, Rue du Docteur René Jacquinet, Saint-Nicaise, Reims, Marne, Grand Est, France métropolitaine, 51100, France";"8";"Rue du Docteur René Jacquinet";"";"Reims";"Marne";"Grand Est";"51100";"France";"49.2434364";"4.047497"
"70feb66c2fc91429e7ae0affc43aa80e65bf949f";"15, Rue des Augustins, Reims, Marne, Grand Est, France métropolitaine, 51100, France";"15";"Rue des Augustins";"";"Reims";"Marne";"Grand Est";"51100";"France";"49.2513414";"4.0391592"
"54ddf4feb942b8b6e7fb212602a7010df8b8e5a0";"Le Boulingrin, 31, Rue de Mars, Quartier Centre Ville, Reims, Marne, Grand Est, France métropolitaine, 51100, France";"31";"Rue de Mars";"";"Reims";"Marne";"Grand Est";"51100";"France";"49.2603671";"4.030874"
"38598a00ba9a92e09fc4358bf1855a47749404fd";"2, Rue d'Oseille, Saint-Nicaise, Saint-Remi, Reims, Marne, Grand Est, France métropolitaine, 51100, France";"2";"Rue d'Oseille";"";"Reims";"Marne";"Grand Est";"51100";"France";"49.2451341";"4.0410512"
"92642fa545ff891ba28aa74cc969ceffa10c7343";"Place Nicolas Bergier, Port Sec, Reims, Marne, Grand Est, France métropolitaine, 51100, France";"";"Place Nicolas Bergier";"";"Reims";"Marne";"Grand Est";"51100";"France";"49.260142099999996";"4.052992853360416"
"10ca3ea97736f17ccc085f1d27900932993ba25a";"44, Rue de Bétheny, Chalet, Port Sec, Reims, Marne, Grand Est, France métropolitaine, 51100, France";"44";"Rue de Bétheny";"";"Reims";"Marne";"Grand Est";"51100";"France";"49.2679769";"4.0470503"
"8259d35a35a2d3b1cbecbe29b8153c84e5032cb5";"10, Rue des Trois Raisinets, Quartier Centre Ville, Reims, Marne, Grand Est, France métropolitaine, 51100, France";"10";"Rue des Trois Raisinets";"";"Reims";"Marne";"Grand Est";"51100";"France";"49.2547139";"4.037682"
"41d745f36a482360530bf358bbe528da47827a76";"Laboratoire Reims Luton, 81, Place Luton, Port Sec, Reims, Marne, Grand Est, France métropolitaine, 51100, France";"81";"Place Luton";"";"Reims";"Marne";"Grand Est";"51100";"France";"49.2708968";"4.0260097"
"c5c892c9f16cbd991612fa97630ca41dbd0441b8";"Rue du Clou dans le Fer, Quartier Centre Ville, Reims, Marne, Grand Est, France métropolitaine, 51100, France";"";"Rue du Clou dans le Fer";"";"Reims";"Marne";"Grand Est";"51100";"France";"49.2543645";"4.0308749"
"6a2d138e61e9d3e275919043746fffe048fe0c8b";"Rue des Romains, Clairmarais, Port Sec, Reims, Marne, Grand Est, France métropolitaine, 51100, France";"";"Rue des Romains";"";"Reims";"Marne";"Grand Est";"51100";"France";"49.2620283";"4.0225322"
"5168f2ec0256f42c30512b879f1c504be06203ce";"39, Rue du Général Carré, Europe, Reims, Marne, Grand Est, France métropolitaine, 51100, France";"39";"Rue du Général Carré";"";"Reims";"Marne";"Grand Est";"51100";"France";"49.2556786";"4.0606616"
"475191748cb97434ac00d62e0aea8b8cdb8fe233";"18, Grande Rue, Saint-Gibrien, Châlons-en-Champagne, Marne, Grand Est, France métropolitaine, 51510, France";"18";"Grande Rue";"";"Châlons-en-Champagne";"Marne";"Grand Est";"51510";"France";"48.9737607";"4.3000996"
"b16fca45338f18c35325aa2a76ca9f2f0242a9c5";"Rue Marx Dormoy, Sauvage, Saint-Just-Sauvage, Épernay, Marne, Grand Est, France métropolitaine, 51260, France";"";"Rue Marx Dormoy";"";"Épernay";"Marne";"Grand Est";"51260";"France";"48.5485468";"3.7703273"
"679470d5caebbb44851ed62f0f134842381a4eef";"Grande Rue des Côtes, Les Grandes Côtes, Sainte-Marie-du-Lac-Nuisement, Vitry-le-François, Marne, Grand Est, France métropolitaine, 51290, France";"";"Grande Rue des Côtes";"";"Vitry-le-François";"Marne";"Grand Est";"51290";"France";"48.6059437";"4.7773977"
"9de871cb8356fa4c6a9cdf1ad96714e81ebdd90f";"Rue Samuel de Champlain, Sillery, Reims, Marne, Grand Est, France métropolitaine, 51500, France";"";"Rue Samuel de Champlain";"";"Reims";"Marne";"Grand Est";"51500";"France";"49.1974429";"4.1348543"
"1aceb39092a79579df0be351630197fdcf2dee92";"Rue du Haut de la Ville, Somme-Yèvre, Châlons-en-Champagne, Marne, Grand Est, France métropolitaine, 51330, France";"";"Rue du Haut de la Ville";"";"Châlons-en-Champagne";"Marne";"Grand Est";"51330";"France";"48.9499771";"4.757029"
"c67a08818c55e0ad940cba7f58f9341c093d0f54";"Rue Saint-Jean-Baptiste, Tramery, Reims, Marne, Grand Est, France métropolitaine, 51170, France";"";"Rue Saint-Jean-Baptiste";"";"Reims";"Marne";"Grand Est";"51170";"France";"49.2239745";"3.8045101"
"d74c7aea389beb7d28ce005c020e1051885322dd";"12, Place de l'Hôtel de Ville, Verzy, Reims, Marne, Grand Est, France métropolitaine, 51380, France";"12";"Place de l'Hôtel de Ville";"";"Reims";"Marne";"Grand Est";"51380";"France";"49.1471867";"4.1632132"
"a7160a3760af4b5649dd98282c858cd6d8a7c0e6";"Rue Saint-Laurent, Ville-en-Tardenois, Reims, Marne, Grand Est, France métropolitaine, 51170, France";"";"Rue Saint-Laurent";"";"Reims";"Marne";"Grand Est";"51170";"France";"49.1822611";"3.8009657"
"c3f9b59f54f7660a46b333ec18365c0347cc2bcd";"Avenue du Val des Bois, Warmeriville, Reims, Marne, Grand Est, France métropolitaine, 51110, France";"";"Avenue du Val des Bois";"";"Reims";"Marne";"Grand Est";"51110";"France";"49.3496231";"4.2145449"
"fa735ebaba0478001450c555bf63ba5c3c25baa6";"Avenue de Reims, Witry-lès-Reims, Reims, Marne, Grand Est, France métropolitaine, 51420, France";"";"Avenue de Reims";"";"Reims";"Marne";"Grand Est";"51420";"France";"49.2844856";"4.1114738"
