"ebec5b885226e86c815a24a352ba4fdd9145a801";"9, Place de la République, L'Anerie, Aigrefeuille-d'Aunis, Rochefort, Charente-Maritime, Nouvelle-Aquitaine, France métropolitaine, 17290, France";"9";"Place de la République";"";"Rochefort";"Charente-Maritime";"Nouvelle-Aquitaine";"17290";"France";"46.1164367";"-0.9344833"
"219095f2b94caaa6d6276f58c833c2adc83257c8";"2, Route de Jonzac, La Coudrée, Chez Pommeraud, Allas-Champagne, Jonzac, Charente-Maritime, Nouvelle-Aquitaine, France métropolitaine, 17500, France";"2";"Route de Jonzac";"";"Jonzac";"Charente-Maritime";"Nouvelle-Aquitaine";"17500";"France";"45.4719653";"-0.3342635"
"2bf9683e0b4eaabe69ff4ebb1756b1346f80f3a8";"Vival, 8, Rue des Sables, Saint-Gilles, Angliers, La Rochelle, Charente-Maritime, Nouvelle-Aquitaine, France métropolitaine, 17540, France";"8";"Rue des Sables";"";"La Rochelle";"Charente-Maritime";"Nouvelle-Aquitaine";"17540";"France";"46.2139042";"-0.9542907"
"0c8f6f4172c21bb7a52d7a61bfc0ab830b6a7afb";"Chemin des Marais, Angoulins, La Rochelle, Charente-Maritime, Nouvelle-Aquitaine, France métropolitaine, 17690, France";"";"Chemin des Marais";"";"La Rochelle";"Charente-Maritime";"Nouvelle-Aquitaine";"17690";"France";"46.1049751";"-1.1187813"
"67e8c8f6f1b4865ca0ff868818da17929645c65e";"Rue du Chay, Angoulins, La Rochelle, Charente-Maritime, Nouvelle-Aquitaine, France métropolitaine, 17690, France";"";"Rue du Chay";"";"La Rochelle";"Charente-Maritime";"Nouvelle-Aquitaine";"17690";"France";"46.1034158";"-1.123661"
"b38898191843a4e230c26e50a42dd7a9338de89a";"Avenue Edmond Grasset, Le Puits Doux, Angoulins, La Rochelle, Charente-Maritime, Nouvelle-Aquitaine, France métropolitaine, 17690, France";"";"Avenue Edmond Grasset";"";"La Rochelle";"Charente-Maritime";"Nouvelle-Aquitaine";"17690";"France";"46.1057806";"-1.1085525"
"a9a8e16fcd87781eeafba0b7c170cdd012c131f9";"Rue des Albizzias, Le Puits Doux, Angoulins, La Rochelle, Charente-Maritime, Nouvelle-Aquitaine, France métropolitaine, 17690, France";"";"Rue des Albizzias";"";"La Rochelle";"Charente-Maritime";"Nouvelle-Aquitaine";"17690";"France";"46.1087237";"-1.1088907"
"d93a57f691f4cfdf08dbb0d6b04c536f6cc5142d";"Chemin des Russons, Zone d'activité des Fourneaux, La Cabane Brûlée, Angoulins, La Rochelle, Charente-Maritime, Nouvelle-Aquitaine, France métropolitaine, 17690, France";"";"Chemin des Russons";"";"La Rochelle";"Charente-Maritime";"Nouvelle-Aquitaine";"17690";"France";"46.1118244";"-1.1088183"
"5e878c8457944e6d396851648700fcb635045fb7";"Rue du Pâtis, Lotissement Les Acacias, La Roche, Archiac, Jonzac, Charente-Maritime, Nouvelle-Aquitaine, France métropolitaine, 17520, France";"";"Rue du Pâtis";"";"Jonzac";"Charente-Maritime";"Nouvelle-Aquitaine";"17520";"France";"45.5206757";"-0.3043597"
"35800fc905307b5c6de33e39d2a35056fc1090eb";"Rue du Presbytère, La Font, Arthenac, Jonzac, Charente-Maritime, Nouvelle-Aquitaine, France métropolitaine, 17520, France";"";"Rue du Presbytère";"";"Jonzac";"Charente-Maritime";"Nouvelle-Aquitaine";"17520";"France";"45.5145059";"-0.3131088"
"2200da9cd2b25552d1af5625013238ce6c8c4e7b";"Avenue de Saint-Jean d'Angély, Résidence Les Tilleuls, Asnières-la-Giraud, Saint-Jean-d'Angély, Charente-Maritime, Nouvelle-Aquitaine, France métropolitaine, 17400, France";"";"Avenue de Saint-Jean d'Angély";"";"Saint-Jean-d'Angély";"Charente-Maritime";"Nouvelle-Aquitaine";"17400";"France";"45.8905449";"-0.5216746"
"8ef2cfd501f16713fd2d385863765e924aabcda3";"Boulangerie du Centre, 29, Place Aristide Briand, Aulnay, Saint-Jean-d'Angély, Charente-Maritime, Nouvelle-Aquitaine, France métropolitaine, 17470, France";"29";"Place Aristide Briand";"";"Saint-Jean-d'Angély";"Charente-Maritime";"Nouvelle-Aquitaine";"17470";"France";"46.0205104";"-0.3467459"
"2b9659298bfb924f26d4f19adf1686409995964a";"2, Rue Principale, Bignay, Saint-Jean-d'Angély, Charente-Maritime, Nouvelle-Aquitaine, France métropolitaine, 17400, France";"2";"Rue Principale";"";"Saint-Jean-d'Angély";"Charente-Maritime";"Nouvelle-Aquitaine";"17400";"France";"45.916409";"-0.601395"
"a7f664b71cf89d4e1aa6fea2c42956fbd3f68350";"4, Allée de la Mairie, Bignay, Saint-Jean-d'Angély, Charente-Maritime, Nouvelle-Aquitaine, France métropolitaine, 17400, France";"4";"Allée de la Mairie";"";"Saint-Jean-d'Angély";"Charente-Maritime";"Nouvelle-Aquitaine";"17400";"France";"45.917059";"-0.600911"
"8919e27c3155574c9cfe463c12d8f0b6e6467188";"Place Henri Barbusse, Le Chapus, Bourcefranc-le-Chapus, Rochefort, Charente-Maritime, Nouvelle-Aquitaine, France métropolitaine, 17560, France";"";"Place Henri Barbusse";"";"Rochefort";"Charente-Maritime";"Nouvelle-Aquitaine";"17560";"France";"45.847355";"-1.1475207615727183"
"35c7956934770d0941aa9489e84015ed1ddc97e6";"Rue de Betphagé, Bourgneuf, La Rochelle, Charente-Maritime, Nouvelle-Aquitaine, France métropolitaine, 17220, France";"";"Rue de Betphagé";"";"La Rochelle";"Charente-Maritime";"Nouvelle-Aquitaine";"17220";"France";"46.1676915";"-1.0204132"
"a9d419ddc22fb1eb7408afefc043b4ff72ab766d";"Place de l'Église, Bourgneuf, La Rochelle, Charente-Maritime, Nouvelle-Aquitaine, France métropolitaine, 17220, France";"";"";"";"La Rochelle";"Charente-Maritime";"Nouvelle-Aquitaine";"17220";"France";"46.167334049999994";"-1.0239755503020649"
"d8c4e2e373924c2ec34910f208ad95f35176f343";"Rue de Saintonge, Chez Viaud, Touvent, Boutenac-Touvent, Saintes, Charente-Maritime, Nouvelle-Aquitaine, France métropolitaine, 17120, France";"";"Rue de Saintonge";"";"Saintes";"Charente-Maritime";"Nouvelle-Aquitaine";"17120";"France";"45.5071701";"-0.7537684"
"f44c747947cd10008891bb0c03af6ede1ddadca3";"Rue du Centre, Le Candé, Breuillet, Rochefort, Charente-Maritime, Nouvelle-Aquitaine, France métropolitaine, 17920, France";"";"Rue du Centre";"";"Rochefort";"Charente-Maritime";"Nouvelle-Aquitaine";"17920";"France";"45.6906709";"-1.0550746"
"0091c1eef8a94f9242623a511c1bc952078c0949";"Avenue de Royan, Petites Marques, Brie-sous-Mortagne, Saintes, Charente-Maritime, Nouvelle-Aquitaine, France métropolitaine, 17120, France";"";"Avenue de Royan";"";"Saintes";"Charente-Maritime";"Nouvelle-Aquitaine";"17120";"France";"45.496733";"-0.748223"
"208983596a219303259b433aa0c13e0b91f33ee8";"12, Rue de la Mairie, La Métairie, Bassolais, Cercoux, Jonzac, Charente-Maritime, Nouvelle-Aquitaine, France métropolitaine, 17270, France";"12";"Rue de la Mairie";"";"Jonzac";"Charente-Maritime";"Nouvelle-Aquitaine";"17270";"France";"45.1286496";"-0.205418"
"8ed91fe4896477c150557eccb458d9c305ef49f7";"3, Rue de la Rochelle, Quartier des Dunes, Quartier du Casino, Châtelaillon-Plage, La Rochelle, Charente-Maritime, Nouvelle-Aquitaine, France métropolitaine, 17340, France";"3";"Rue de la Rochelle";"";"La Rochelle";"Charente-Maritime";"Nouvelle-Aquitaine";"17340";"France";"46.0721503";"-1.089071"
"49f8a83c31a0deee58cdec0fd92915c86ad24d95";"Rue de la Mairie, Cherbonnières, Saint-Jean-d'Angély, Charente-Maritime, Nouvelle-Aquitaine, France métropolitaine, 17470, France";"";"Rue de la Mairie";"";"Saint-Jean-d'Angély";"Charente-Maritime";"Nouvelle-Aquitaine";"17470";"France";"45.963352";"-0.3378199"
"e0500a516c144a657275a4b625f60512e73214d2";"Allée des Bodins, Les Bodins, Chermignac, Saintes, Charente-Maritime, Nouvelle-Aquitaine, France métropolitaine, 17460, France";"";"Allée des Bodins";"";"Saintes";"Charente-Maritime";"Nouvelle-Aquitaine";"17460";"France";"45.7001729";"-0.6951159"
"52e4056e833aec349d508239f2befceb5b551b07";"Rue des Jardins, Ciré-d'Aunis, Rochefort, Charente-Maritime, Nouvelle-Aquitaine, France métropolitaine, 17290, France";"";"Rue des Jardins";"";"Rochefort";"Charente-Maritime";"Nouvelle-Aquitaine";"17290";"France";"46.0563154";"-0.9297952"
"9732e683f0ef99925927dff6aeeb1d705a2d3a20";"Rue du Moulin, Le Treuil-Chartier, Clavette, La Rochelle, Charente-Maritime, Nouvelle-Aquitaine, France métropolitaine, 17220, France";"";"Rue du Moulin";"";"La Rochelle";"Charente-Maritime";"Nouvelle-Aquitaine";"17220";"France";"46.1428622";"-1.0279244"
"32796380ae15a4ac5dfbb5acf8d0b89741c52916";"Rue de la Mairie, Coivert, Saint-Jean-d'Angély, Charente-Maritime, Nouvelle-Aquitaine, France métropolitaine, 17330, France";"";"Rue de la Mairie";"";"Saint-Jean-d'Angély";"Charente-Maritime";"Nouvelle-Aquitaine";"17330";"France";"46.0699392";"-0.4574389"
"e0e6a431b10a7edec831e1083b3de2422844196f";"Rue de Marans, Moulin des Prés, Courçon, La Rochelle, Charente-Maritime, Nouvelle-Aquitaine, France métropolitaine, 17170, France";"";"Rue de Marans";"";"La Rochelle";"Charente-Maritime";"Nouvelle-Aquitaine";"17170";"France";"46.247212";"-0.8174925"
"dc1f8d3f998b02c9e44e9bbeb4bbc808afcfe114";"2, Allée des Soupirs, Florimonde, Cozes, Saintes, Charente-Maritime, Nouvelle-Aquitaine, France métropolitaine, 17120, France";"2";"Allée des Soupirs";"";"Saintes";"Charente-Maritime";"Nouvelle-Aquitaine";"17120";"France";"45.5838634";"-0.8299199"
"149c9254606a4d2f16c7e44c03b50756f584abf6";"Rue des Vieux Moulins, Chaban, Cram-Chaban, La Rochelle, Charente-Maritime, Nouvelle-Aquitaine, France métropolitaine, 17170, France";"";"Rue des Vieux Moulins";"";"La Rochelle";"Charente-Maritime";"Nouvelle-Aquitaine";"17170";"France";"46.2149637";"-0.7031653"
"554121aab1b6454ea0bdfd8278c07cd650f61931";"Route du Gerzeau, La Grande Mercerie, Cravans, Saintes, Charente-Maritime, Nouvelle-Aquitaine, France métropolitaine, 17260, France";"";"Route du Gerzeau";"";"Saintes";"Charente-Maritime";"Nouvelle-Aquitaine";"17260";"France";"45.6026959";"-0.7183031"
"4b51fc0bb23d39e1dcff503a52e91ccc86a36349";"8, Rue de Saintonge, Les Monceaux, Crazannes, Saintes, Charente-Maritime, Nouvelle-Aquitaine, France métropolitaine, 17350, France";"8";"Rue de Saintonge";"";"Saintes";"Charente-Maritime";"Nouvelle-Aquitaine";"17350";"France";"45.8467755";"-0.7040238512068966"
"3b215c28421e76050c1dc86a2c71d2d5d2dca809";"Rue de la Poste, Dampierre-sur-Boutonne, Saint-Jean-d'Angély, Charente-Maritime, Nouvelle-Aquitaine, France métropolitaine, 17470, France";"";"Rue de la Poste";"";"Saint-Jean-d'Angély";"Charente-Maritime";"Nouvelle-Aquitaine";"17470";"France";"46.0662322";"-0.4138592"
"79f843aca3bdd18397740cfd28809f9034f96bff";"Dompierre-sur-Mer, 34, Rue du Général de Gaulle, La Fromagère, Dompierre-sur-Mer, La Rochelle, Charente-Maritime, Nouvelle-Aquitaine, France métropolitaine, 17139, France";"34";"Rue du Général de Gaulle";"";"La Rochelle";"Charente-Maritime";"Nouvelle-Aquitaine";"17139";"France";"46.18869385";"-1.0668396645177074"
"1acafc8f877e37a7e72cb2116860e12d9e2adab2";"Rue de l'Église, Les Eronnelles, Les Brossards, Échillais, Rochefort, Charente-Maritime, Nouvelle-Aquitaine, France métropolitaine, 17620, France";"";"Rue de l'Église";"";"Rochefort";"Charente-Maritime";"Nouvelle-Aquitaine";"17620";"France";"45.898208";"-0.9530317"
"67de10c53298ad7d9460303d8a022ff92208f901";"Rue des Coccinelles, Le Bois Darguet, Écoyeux, Saintes, Charente-Maritime, Nouvelle-Aquitaine, France métropolitaine, 17770, France";"";"Rue des Coccinelles";"";"Saintes";"Charente-Maritime";"Nouvelle-Aquitaine";"17770";"France";"45.8093982";"-0.5435103"
"374eebecc3de8d2f32fab4324b068aece1b88c6e";"Avenue de la République, Résidence Le Carrick, Esnandes, La Rochelle, Charente-Maritime, Nouvelle-Aquitaine, France métropolitaine, 17137, France";"";"Avenue de la République";"";"La Rochelle";"Charente-Maritime";"Nouvelle-Aquitaine";"17137";"France";"46.2487219";"-1.1168375"
"2781c012bdfe7f457a477f79f58447fd61d98d59";"Place Carnot, Fouras, Rochefort, Charente-Maritime, Nouvelle-Aquitaine, France métropolitaine, 17450, France";"";"Place Carnot";"";"Rochefort";"Charente-Maritime";"Nouvelle-Aquitaine";"17450";"France";"45.988668000000004";"-1.09716122582552"
"603939aab4bb954e624c41500ecf6a69707b5b00";"Rue du Général Bruncher, Fouras, Rochefort, Charente-Maritime, Nouvelle-Aquitaine, France métropolitaine, 17450, France";"";"Rue du Général Bruncher";"";"Rochefort";"Charente-Maritime";"Nouvelle-Aquitaine";"17450";"France";"45.9872547";"-1.0974057"
"53544f86233f338608f3daf9ca5bfe543aabd243";"6, Rue James Sclafer, Le Bourg Nouveau, Bourg Nouveau, Jonzac, Charente-Maritime, Nouvelle-Aquitaine, France métropolitaine, 17500, France";"6";"Rue James Sclafer";"Jonzac";"Jonzac";"Charente-Maritime";"Nouvelle-Aquitaine";"17500";"France";"45.4447027";"-0.4344906"
"d48db6d5d652c8c32f94744f82332ddd24da222f";"28, Place du Château, Le Bourg Nouveau, Bourg Nouveau, Jonzac, Charente-Maritime, Nouvelle-Aquitaine, France métropolitaine, 17500, France";"28";"Place du Château";"Jonzac";"Jonzac";"Charente-Maritime";"Nouvelle-Aquitaine";"17500";"France";"45.4453149";"-0.4321847"
"ea98742cec6580c57e8406ef175e405ec33457f5";"Esplanade Charles de Gaulle, Les Portes Océanes, Les Hauts de l'Ajonc, L'Houmeau, La Rochelle, Charente-Maritime, Nouvelle-Aquitaine, France métropolitaine, 17137, France";"";"";"";"La Rochelle";"Charente-Maritime";"Nouvelle-Aquitaine";"17137";"France";"46.192683200000005";"-1.1871385434135915"
"ad944d5f88c22392db0c74035d14ba89d81f5b7c";"Rue de Saintonge, La Croix, La Brousse, Saint-Jean-d'Angély, Charente-Maritime, Nouvelle-Aquitaine, France métropolitaine, 17160, France";"";"Rue de Saintonge";"";"Saint-Jean-d'Angély";"Charente-Maritime";"Nouvelle-Aquitaine";"17160";"France";"45.8910972";"-0.3630271"
"66e2d3b8794145d16b90da211aced82ee7651902";"Rue de la République, La Chapelle-des-Pots, Saintes, Charente-Maritime, Nouvelle-Aquitaine, France métropolitaine, 17100, France";"";"Rue de la République";"";"Saintes";"Charente-Maritime";"Nouvelle-Aquitaine";"17100";"France";"45.7589043";"-0.5407503"
"e137b5581745b8b5f7818a0b557013635588218a";"Avenue du Mail, La Couarde-sur-Mer, La Rochelle, Charente-Maritime, Nouvelle-Aquitaine, France métropolitaine, 17670, France";"";"Avenue du Mail";"";"La Rochelle";"Charente-Maritime";"Nouvelle-Aquitaine";"17670";"France";"46.191959";"-1.4259522"
"816553ebedd116d03c929780c3b83f89b4c49d8f";"Ruelle des Ormes, La Flotte, La Rochelle, Charente-Maritime, Nouvelle-Aquitaine, France métropolitaine, 17630, France";"";"Ruelle des Ormes";"";"La Rochelle";"Charente-Maritime";"Nouvelle-Aquitaine";"17630";"France";"46.1877331";"-1.32517"
"655e78943a80eec78be1139078a97fc86c0c6c32";"Rue des Caillotières, ZAC La Croix Michaud, La Flotte, La Rochelle, Charente-Maritime, Nouvelle-Aquitaine, France métropolitaine, 17630, France";"";"Rue des Caillotières";"";"La Rochelle";"Charente-Maritime";"Nouvelle-Aquitaine";"17630";"France";"46.1800682";"-1.3258622"
"619270487154773e6b763d8e5cb75d8dc2c24fee";"12ter, Rue de l'Église, Le Ranclos, Givrand, La Jarne, La Rochelle, Charente-Maritime, Nouvelle-Aquitaine, France métropolitaine, 17220, France";"12ter";"Rue de l'Église";"";"La Rochelle";"Charente-Maritime";"Nouvelle-Aquitaine";"17220";"France";"46.1280638";"-1.0723855"
"bf5fa11e2e7715d4facd181556ba346e1e34a5e7";"Rue de l'Alerte, Les Pernelles, La Jarrie, La Rochelle, Charente-Maritime, Nouvelle-Aquitaine, France métropolitaine, 17220, France";"";"Rue de l'Alerte";"";"La Rochelle";"Charente-Maritime";"Nouvelle-Aquitaine";"17220";"France";"46.1269577";"-1.0074071"
"0be439274654a0b7da1685b01eb1ca414a9fff2f";"6, Rue de l'Alerte, Les Pernelles, La Jarrie, La Rochelle, Charente-Maritime, Nouvelle-Aquitaine, France métropolitaine, 17220, France";"6";"Rue de l'Alerte";"";"La Rochelle";"Charente-Maritime";"Nouvelle-Aquitaine";"17220";"France";"46.1264843";"-1.0079534"
"c7a5bf575f4b8674c2008885ebfbc9c18160b577";"Route de Loulay, La Jarrie-Audouin, Saint-Jean-d'Angély, Charente-Maritime, Nouvelle-Aquitaine, France métropolitaine, 17330, France";"";"Route de Loulay";"";"Saint-Jean-d'Angély";"Charente-Maritime";"Nouvelle-Aquitaine";"17330";"France";"46.0325831";"-0.4902855"
"375535dc40c18b0275eb9315096685b81d5537b9";"32, Rue du Cordouan, Cougnes, La Rochelle, Charente-Maritime, Nouvelle-Aquitaine, France métropolitaine, 17000, France";"32";"Rue du Cordouan";"";"La Rochelle";"Charente-Maritime";"Nouvelle-Aquitaine";"17000";"France";"46.1636946";"-1.1490766"
"c0a85fc841b960e034d62ccdc05977cf313cb1f6";"3, Rue Bujaud, Arsenal, La Rochelle, Charente-Maritime, Nouvelle-Aquitaine, France métropolitaine, 17000, France";"3";"Rue Bujaud";"";"La Rochelle";"Charente-Maritime";"Nouvelle-Aquitaine";"17000";"France";"46.1606988";"-1.1504794"
"1c2b3f1bedb0b5a715813edfba7fc34597665f70";"Rue du Vélodrome, Lafond, La Rochelle, Charente-Maritime, Nouvelle-Aquitaine, France métropolitaine, 17000, France";"";"Rue du Vélodrome";"";"La Rochelle";"Charente-Maritime";"Nouvelle-Aquitaine";"17000";"France";"46.1714658";"-1.1423477"
"5cd826aa222b3a7a8e135d711d979af406ac2c5b";"Rue Pilâtre de Rozier, Beauregard, La Rochelle, Charente-Maritime, Nouvelle-Aquitaine, France métropolitaine, 17000, France";"";"Rue Pilâtre de Rozier";"";"La Rochelle";"Charente-Maritime";"Nouvelle-Aquitaine";"17000";"France";"46.1655155";"-1.1237758"
"948c06a89b812959055da476c56585b5a994d755";"Avenue Gabrielle, Ronce-les-Bains, La Tremblade, Rochefort, Charente-Maritime, Nouvelle-Aquitaine, France métropolitaine, 17390, France";"";"Avenue Gabrielle";"";"Rochefort";"Charente-Maritime";"Nouvelle-Aquitaine";"17390";"France";"45.799815";"-1.1609681"
"9ab9ab45b7487ea3d5bbbf90eb4c5425c0ef53e9";"2, Rue de la République, Landes, Saint-Jean-d'Angély, Charente-Maritime, Nouvelle-Aquitaine, France métropolitaine, 17380, France";"2";"Rue de la République";"";"Saint-Jean-d'Angély";"Charente-Maritime";"Nouvelle-Aquitaine";"17380";"France";"45.992612";"-0.596778"
"7e16af3e80caf9b131516d3363314d003f4e3daa";"Rue Louis Barthou, Le Morinand, Le Bois-Plage-en-Ré, La Rochelle, Charente-Maritime, Nouvelle-Aquitaine, France métropolitaine, 17580, France";"";"Rue Louis Barthou";"";"La Rochelle";"Charente-Maritime";"Nouvelle-Aquitaine";"17580";"France";"46.1877165";"-1.3815324"
"bee296a0da374f8c0f5c3d904dd7e0d069ed433a";"Rue Aristide Briand, Le Bois-Plage-en-Ré, La Rochelle, Charente-Maritime, Nouvelle-Aquitaine, France métropolitaine, 17580, France";"";"Rue Aristide Briand";"";"La Rochelle";"Charente-Maritime";"Nouvelle-Aquitaine";"17580";"France";"46.1863499";"-1.3918029"
"5e8b1baf77ebec583a6536377c77db7e17e0e84b";"Avenue de la Plage, Le Bois-Plage-en-Ré, La Rochelle, Charente-Maritime, Nouvelle-Aquitaine, France métropolitaine, 17580, France";"";"Avenue de la Plage";"";"La Rochelle";"Charente-Maritime";"Nouvelle-Aquitaine";"17580";"France";"46.1822935";"-1.3935936"
"748297da1e1a165374678a9e092c71303b920aef";"Rue Benjamin Delessert, Le Château-d'Oléron, Rochefort, Charente-Maritime, Nouvelle-Aquitaine, France métropolitaine, 17480, France";"";"Rue Benjamin Delessert";"";"Rochefort";"Charente-Maritime";"Nouvelle-Aquitaine";"17480";"France";"45.8867566";"-1.1946534"
"48b3be40142073e17c1ecfa3fd40358514944f84";"Rue de Saint-Légier, Dercie, Le Gua, Rochefort, Charente-Maritime, Nouvelle-Aquitaine, France métropolitaine, 17600, France";"";"Rue de Saint-Légier";"";"Rochefort";"Charente-Maritime";"Nouvelle-Aquitaine";"17600";"France";"45.7080148";"-0.9385183"
"5793907bdbd2b4d1fd15bbda8909cdac1b695961";"Place des Gillardeaux, Les Gilardeaux, Les Gonds, Saintes, Charente-Maritime, Nouvelle-Aquitaine, France métropolitaine, 17100, France";"";"Place des Gillardeaux";"";"Saintes";"Charente-Maritime";"Nouvelle-Aquitaine";"17100";"France";"45.7186974";"-0.6290329"
"583fb7b9d80dc358a08ad87fc92ec694d14b5442";"Avenue d'Aunis, Le Clapet, La Palmyre, Les Mathes, Rochefort, Charente-Maritime, Nouvelle-Aquitaine, France métropolitaine, 17570, France";"";"Avenue d'Aunis";"";"Rochefort";"Charente-Maritime";"Nouvelle-Aquitaine";"17570";"France";"45.6895682";"-1.1791083"
"41e5e62885c70bc171cb34796ca5bb3bec82a621";"Grande Rue, Les Nouillers, Saint-Jean-d'Angély, Charente-Maritime, Nouvelle-Aquitaine, France métropolitaine, 17380, France";"";"Grande Rue";"";"Saint-Jean-d'Angély";"Charente-Maritime";"Nouvelle-Aquitaine";"17380";"France";"45.9314903";"-0.6642599"
"4ee105c47bdb7b62a358fad2011ff1fd9684c5e6";"Rue des Marronniers, Fief de la Cure, Longèves, La Rochelle, Charente-Maritime, Nouvelle-Aquitaine, France métropolitaine, 17230, France";"";"Rue des Marronniers";"";"La Rochelle";"Charente-Maritime";"Nouvelle-Aquitaine";"17230";"France";"46.2265738";"-0.9930864"
"4d085bde58854fa133ae0a6a9a224306aa7b37db";"Rue de la Gare, Loulay, Saint-Jean-d'Angély, Charente-Maritime, Nouvelle-Aquitaine, France métropolitaine, 17330, France";"";"Rue de la Gare";"";"Saint-Jean-d'Angély";"Charente-Maritime";"Nouvelle-Aquitaine";"17330";"France";"46.0440271";"-0.5047331"
"3679a77b370614176d40c7bc4554dae45f75c7ed";"Rue Poirier Chapelle, Lussant, Rochefort, Charente-Maritime, Nouvelle-Aquitaine, France métropolitaine, 17430, France";"";"Rue Poirier Chapelle";"";"Rochefort";"Charente-Maritime";"Nouvelle-Aquitaine";"17430";"France";"45.9582559";"-0.8235702"
"0a7ccc8f6d85dc867836bd6788f5cf14d4251ac7";"Rue Neuve, Marans, La Rochelle, Charente-Maritime, Nouvelle-Aquitaine, France métropolitaine, 17230, France";"";"Rue Neuve";"";"La Rochelle";"Charente-Maritime";"Nouvelle-Aquitaine";"17230";"France";"46.3094262";"-0.992516"
"03a4fe74ae8923bceb6cfba11b505fde17cb71a4";"Chemin du Midi, Marsais, Rochefort, Charente-Maritime, Nouvelle-Aquitaine, France métropolitaine, 17700, France";"";"Chemin du Midi";"";"Rochefort";"Charente-Maritime";"Nouvelle-Aquitaine";"17700";"France";"46.1253035";"-0.601566"
"b21327f72deef359cf7c6a795339dd0e9a46d2ea";"Rue de l'Ancienne Poste, Le Clos du Puits, Les Salles, Marsilly, La Rochelle, Charente-Maritime, Nouvelle-Aquitaine, France métropolitaine, 17137, France";"";"Rue de l'Ancienne Poste";"";"La Rochelle";"Charente-Maritime";"Nouvelle-Aquitaine";"17137";"France";"46.2304431";"-1.1409163"
"610ab89588a21bc917e7c9f0b5d4ba885720d46a";"Rue de Saint-Hérie, Saint-Hérie, Champ Feron, Matha, Saint-Jean-d'Angély, Charente-Maritime, Nouvelle-Aquitaine, France métropolitaine, 17160, France";"";"Rue de Saint-Hérie";"";"Saint-Jean-d'Angély";"Charente-Maritime";"Nouvelle-Aquitaine";"17160";"France";"45.8617156";"-0.3213531"
"70cec1c27e3c030eb9f3f669aa36610a2bc9011b";"Rue des Champs de Foire, Badon, La Fabrique, Matha, Saint-Jean-d'Angély, Charente-Maritime, Nouvelle-Aquitaine, France métropolitaine, 17160, France";"";"Rue des Champs de Foire";"";"Saint-Jean-d'Angély";"Charente-Maritime";"Nouvelle-Aquitaine";"17160";"France";"45.8701624";"-0.3164001"
"bb2d68298d4ee0afb4359c9621a98164e09f68b9";"11, Rue du Fief des Sables, Meschers-sur-Gironde, Rochefort, Charente-Maritime, Nouvelle-Aquitaine, France métropolitaine, 17132, France";"11";"Rue du Fief des Sables";"";"Rochefort";"Charente-Maritime";"Nouvelle-Aquitaine";"17132";"France";"45.5611025";"-0.9643145"
"7abab4a4a93edd4d943c05da285bc3228f887bac";"Avenue du Général de Gaulle, La Pierre Levée, Moëze, Rochefort, Charente-Maritime, Nouvelle-Aquitaine, France métropolitaine, 17780, France";"";"Avenue du Général de Gaulle";"";"Rochefort";"Charente-Maritime";"Nouvelle-Aquitaine";"17780";"France";"45.9039971";"-1.0369999"
"5932310e2c7d5507b34bfc92ef5c65bc2d10f34d";"Plaine des Sports, Le Maine Comte, Montguyon, Jonzac, Charente-Maritime, Nouvelle-Aquitaine, France métropolitaine, 17270, France";"";"Plaine des Sports";"";"Jonzac";"Charente-Maritime";"Nouvelle-Aquitaine";"17270";"France";"45.2180692";"-0.1839224"
"2bf8d0350ccdae51e85dee66292b1b80d4fd64ec";"Rue du Château d'Eau, Les Maines, Montguyon, Jonzac, Charente-Maritime, Nouvelle-Aquitaine, France métropolitaine, 17270, France";"";"Rue du Château d'Eau";"";"Jonzac";"Charente-Maritime";"Nouvelle-Aquitaine";"17270";"France";"45.2232468";"-0.1727333"
"846eb7c01cb9358730ba34ef1e189508a160e997";"Rue du Prieuré, Mornac-sur-Seudre, Rochefort, Charente-Maritime, Nouvelle-Aquitaine, France métropolitaine, 17113, France";"";"Rue du Prieuré";"";"Rochefort";"Charente-Maritime";"Nouvelle-Aquitaine";"17113";"France";"45.7088338";"-1.0303828"
"3e567cddb52d1b4b353f73b93e566a8e3d2a3aee";"Rue du Marvoux, Mornac-sur-Seudre, Rochefort, Charente-Maritime, Nouvelle-Aquitaine, France métropolitaine, 17113, France";"";"Rue du Marvoux";"";"Rochefort";"Charente-Maritime";"Nouvelle-Aquitaine";"17113";"France";"45.7109534";"-1.0329103"
"91a90db7616acb822f578bd1a2bcb709dcf21d35";"Rue de la Mairie, Les Rollets, Nachamps, Saint-Jean-d'Angély, Charente-Maritime, Nouvelle-Aquitaine, France métropolitaine, 17380, France";"";"Rue de la Mairie";"";"Saint-Jean-d'Angély";"Charente-Maritime";"Nouvelle-Aquitaine";"17380";"France";"46.0172376";"-0.6242601"
"a45ffedd10254dc3ec0c7936d71281a4beaa67b4";"Rue des Écoles, Nieul-le-Virouil, Jonzac, Charente-Maritime, Nouvelle-Aquitaine, France métropolitaine, 17150, France";"";"Rue des Écoles";"";"Jonzac";"Charente-Maritime";"Nouvelle-Aquitaine";"17150";"France";"45.4090439";"-0.5312446"
"80d2cb3b3ece0fe2f2ef9bd2453ddeb2ba87e8d3";"11, Avenue du Tarnac, Nieul-le-Virouil, Jonzac, Charente-Maritime, Nouvelle-Aquitaine, France métropolitaine, 17150, France";"11";"Avenue du Tarnac";"";"Jonzac";"Charente-Maritime";"Nouvelle-Aquitaine";"17150";"France";"45.408496";"-0.530627"
"eedd189ddea996154c2a23fbde88254a049e5715";"Avenue du Parc, Nieul-sur-Mer, La Rochelle, Charente-Maritime, Nouvelle-Aquitaine, France métropolitaine, 17137, France";"";"Avenue du Parc";"";"La Rochelle";"Charente-Maritime";"Nouvelle-Aquitaine";"17137";"France";"46.2093899";"-1.163433"
"1db76c8ecb4d6ca450849dbaab4491c718330054";"Rue Léonce Vieljeux, Nieul-sur-Mer, La Rochelle, Charente-Maritime, Nouvelle-Aquitaine, France métropolitaine, 17137, France";"";"Rue Léonce Vieljeux";"";"La Rochelle";"Charente-Maritime";"Nouvelle-Aquitaine";"17137";"France";"46.2065078";"-1.1634261"
"3ce1ee496cfc506b92e91884da2e283f174cc781";"Route d'Aulnay, La Fragnée, Nuaillé-sur-Boutonne, Saint-Jean-d'Angély, Charente-Maritime, Nouvelle-Aquitaine, France métropolitaine, 17470, France";"";"Route d'Aulnay";"";"Saint-Jean-d'Angély";"Charente-Maritime";"Nouvelle-Aquitaine";"17470";"France";"46.0126379";"-0.4351549"
